{
  "schema_version": 1,
  "id": "shift-manager",
  "title": "Shift Manager Runbook",
  "role": "shift_manager",
  "purpose": "Enter live contest sales and returned Bingo cards, verify the visible boards, reconcile receipts, and hand off exceptions without changing contest rules or inventing check data.",
  "authority": {
    "allowed": [
      "Inspect the active contest, prize, goals, servers, boards, and recent operation receipts",
      "Record positive quantities for active contest item-count targets",
      "Log a returned current Bingo card",
      "Record a complete check only when every source fact is known",
      "Correct a source check with an audit reason",
      "Write evidence and discovery artifacts inside the assigned run directory"
    ],
    "forbidden": [
      "Activate or replace a contest",
      "Change prizes, goals, scoring, or game rules",
      "Lock a race, award a goal board, or draw a prize winner",
      "Use a negative contest tally as an offset",
      "Invent full-check facts to represent a contest-only quantity",
      "Edit product source, seed data, specs, or prompts during an operating run",
      "Use SQL or an API to conceal a blocked UI discovery step"
    ]
  },
  "steps": [
    {
      "id": "SM-01",
      "phase": "preflight",
      "title": "Confirm the active shift contest",
      "instruction": "Open Dashboard and state the active contest, prize, goals, and remaining time before entering sales.",
      "mode": "read",
      "preconditions": ["SIM is running against the assigned disposable database"],
      "expected": ["The operator can name the active contest and prize", "The Dashboard and operations snapshot report the same contest ID"],
      "confirmation": "none",
      "allowed_tools": ["browser", "sim_ops:get_ops_snapshot"],
      "forbidden_shortcuts": ["Assuming the contest from a previous shift", "Reading the database directly instead of checking the UI"],
      "evidence": [{ "id": "SM-01-dashboard", "required": true, "ui_path": "/", "wait_for": "Active contest", "capture_name": "01-shift-dashboard.png", "receipt_required": false }],
      "observations": ["Could a shift manager immediately tell what item to sell and what can be won?", "Is the time window unambiguous?"],
      "recovery": ["Stop if the UI and snapshot identify different contests"]
    },
    {
      "id": "SM-02",
      "phase": "live",
      "title": "Open a server's contest tally",
      "instruction": "Open Sales Data, find the scenario server, and select Add contest sales so the tool unfolds beneath that server row.",
      "mode": "read",
      "preconditions": ["SM-01 is complete", "The scenario server is active"],
      "expected": ["The tally tool opens inline under the selected server", "Only active contest item-count targets are offered"],
      "confirmation": "none",
      "allowed_tools": ["browser", "sim_ops:get_ops_snapshot"],
      "forbidden_shortcuts": ["Opening a detached form", "Searching the full menu to find a contest item", "Inventing a server or item ID"],
      "evidence": [{ "id": "SM-02-server-tally", "required": true, "ui_path": "/data?server={server_id}&panel=contest", "wait_for": "Add contest sales", "capture_name": "02-server-tally-open.png", "receipt_required": false }],
      "observations": ["Was the correct server easy to find?", "Did the row stay visually connected to its open tool?"],
      "recovery": ["Stop if the target item is absent or an unrelated menu item is offered"]
    },
    {
      "id": "SM-03",
      "phase": "live",
      "title": "Review the contest quantity",
      "instruction": "Choose the scenario contest item when necessary, enter the positive quantity, and review the automatically calculated count and value before submitting.",
      "mode": "ui_write",
      "preconditions": ["The intended server tally is open", "The active contest and expected contest ID have not changed"],
      "expected": ["No party size or manual subtotal is required", "The item value is calculated automatically", "The quantity is a positive whole number"],
      "confirmation": "none",
      "allowed_tools": ["browser"],
      "forbidden_shortcuts": ["Using Add full check", "Entering a manual subtotal", "Using a negative quantity"],
      "evidence": [{ "id": "SM-03-tally-ready", "required": true, "ui_path": "/data?server={server_id}&panel=contest", "wait_for": "Automatic total", "capture_name": "03-contest-tally-ready.png", "receipt_required": false }],
      "observations": ["Did the form ask for anything the shift manager should not need to know?", "Was the automatic calculation trustworthy and readable?"],
      "recovery": ["Do not submit if the server, item, or calculation is wrong"]
    },
    {
      "id": "SM-04",
      "phase": "live",
      "title": "Submit and reconcile contest sales",
      "instruction": "Submit the tally once, retain its operation receipt, and verify that only the scoped item count changed.",
      "mode": "ui_write",
      "preconditions": ["SM-03 review passed", "A unique operation ID is assigned"],
      "expected": ["One append-only contest sales event is recorded", "The server's active item count increases by the entered quantity", "Check count, sales, and tip metrics do not change"],
      "confirmation": "none",
      "allowed_tools": ["browser", "sim_ops:get_operation_receipt", "sim_ops:get_ops_snapshot"],
      "forbidden_shortcuts": ["Double-clicking submit", "Retrying with a new operation ID before reconciliation", "Treating a full check as the tally"],
      "evidence": [{ "id": "SM-04-tally-confirmed", "required": true, "ui_path": "/data?server={server_id}&panel=contest", "wait_for": "Added", "capture_name": "04-contest-tally-confirmed.png", "receipt_required": true }],
      "observations": ["Did the success message identify server, item, quantity, and resulting total?", "Could a retry be mistaken for a second sale?"],
      "recovery": ["Read the original operation receipt before retrying", "Stop on a stale-contest response"]
    },
    {
      "id": "SM-05",
      "phase": "evidence",
      "title": "Verify the live gameboard",
      "instruction": "Open the relevant Sales Gameboard and verify the server score reflects the successful tally.",
      "mode": "read",
      "preconditions": ["The contest tally receipt is successful"],
      "expected": ["The visible board agrees with the read-back snapshot", "The correct server moved by the expected amount"],
      "confirmation": "none",
      "allowed_tools": ["browser", "sim_ops:get_ops_snapshot"],
      "forbidden_shortcuts": ["Using the API snapshot as a substitute for viewing the board"],
      "evidence": [{ "id": "SM-05-board-updated", "required": true, "ui_path": "/games?game={game_id}", "wait_for": "Gameboards", "capture_name": "05-gameboard-updated.png", "receipt_required": true }],
      "observations": ["How long did it take to connect the entry to the correct board?", "Was it clear whether the board updated live or needed refresh?"],
      "recovery": ["Record a data mismatch and stop additional entries if the receipt and board disagree"]
    },
    {
      "id": "SM-06",
      "phase": "live",
      "title": "Mark a returned Bingo card",
      "instruction": "Select the returned current card and mark only completed squares. Click individual squares or drag along one logical row, column, or diagonal; ignore near-miss squares that do not continue that line.",
      "mode": "ui_write",
      "preconditions": ["The physical or scenario card belongs to the selected server", "The card has not been re-randomized since distribution"],
      "expected": ["Marked cells match the returned card", "FREE counts automatically", "A drag gesture does not collect unrelated near-miss squares"],
      "confirmation": "none",
      "allowed_tools": ["browser"],
      "forbidden_shortcuts": ["Marking an assumed line", "Using a stale card", "Adding off-line squares from an imprecise drag"],
      "evidence": [{ "id": "SM-06-bingo-marked", "required": true, "ui_path": "/bingo?server={server_id}", "wait_for": "Log turned-in card", "capture_name": "06-bingo-card-marked.png", "receipt_required": false }],
      "observations": ["Did click-and-drag follow the operator's intended line?", "Could the manager spot a stale or wrong server card before submission?"],
      "recovery": ["Clear incorrect marks before submitting", "Stop if the current UI card differs from the returned card"]
    },
    {
      "id": "SM-07",
      "phase": "live",
      "title": "Log the returned Bingo card",
      "instruction": "Select Log turned-in card once, retain the operation receipt, and read the line, daily-win, and wheel-entry result.",
      "mode": "ui_write",
      "preconditions": ["The marked card has been visually checked", "A unique operation ID is assigned"],
      "expected": ["The submission reports completed lines", "At most one daily win is awarded for the server and business date", "Wheel entries are added only while the drawing is open"],
      "confirmation": "none",
      "allowed_tools": ["browser", "sim_ops:get_operation_receipt", "sim_ops:get_ops_snapshot"],
      "forbidden_shortcuts": ["Submitting a second time with a new operation ID", "Assuming a daily win from line count alone"],
      "evidence": [{ "id": "SM-07-bingo-confirmed", "required": true, "ui_path": "/bingo?server={server_id}", "wait_for": "Lines", "capture_name": "07-bingo-submission.png", "receipt_required": true }],
      "observations": ["Did the result distinguish completed lines from daily-win eligibility?", "Was a duplicate submission understandable?"],
      "recovery": ["Reconcile the original receipt after interruption", "Stop on stale-card or stale-contest errors"]
    },
    {
      "id": "SM-08",
      "phase": "live",
      "title": "Record a complete check when required",